A1: Резултати първи и втори ден
A2: Група С
A4: Rank | B4: Names | C4: Login 2 | D4: Login1 | E4: money | F4: ship | G4: odd | H4: C_day1 | I4: diet | J4: trade | K4: trade | L4: metro | M4: C_day2 | N4: Grand total
A5: 1 | B5: Симеон Иванов Иванов | C5: Log32018 | D5: Log31008 | E5: 100 | F5: 25 | G5: 100 | H5: 225 | I5: 92 | J5: 100 | K5: 100 | L5: 100 | M5: =I5+J5+L5 -> 292 | N5: =H5+M5 -> 517
A6: 2 | B6: Калина Христова Петрова | C6: Log32013 | D6: Log31017 | E6: 100 | F6: 100 | G6: 100 | H6: 300 | I6: 92 | J6: 20 | K6: 40 | L6: 100 | M6: =I6+J6+L6 -> 212 | N6: =H6+M6 -> 512
A7: 3 | B7: Момчил Павлинов Пейчев | C7: Log32008 | D7: Log31019 | E7: 100 | F7: 0 | G7: 100 | H7: 200 | I7: 92 | J7: 100 | K7: 100 | L7: 20 | M7: =I7+J7+L7 -> 212 | N7: =H7+M7 -> 412
A8: 4 | B8: Росен Иванов Желев | C8: Log32009 | D8: Log31014 | E8: 100 | F8: 15 | G8: 100 | H8: 215 | I8: 76 | J8: 20 | K8: 40 | L8: 100 | M8: =I8+J8+L8 -> 196 | N8: =H8+M8 -> 411
A9: 5 | B9: Кирил Христов Кафадаров | C9: Log32003 | D9: Log31000 | E9: 100 | F9: 5 | G9: 100 | H9: 205 | I9: 100 | J9: 0 | K9: 40 | L9: 100 | M9: =I9+J9+L9 -> 200 | N9: =H9+M9 -> 405
A10: 6 | B10: Георги Николаев Георгиев | C10: Log32006 | D10: Log31013 | E10: 100 | F10: 0 | G10: 100 | H10: 200 | I10: 60 | J10: 40 | K10: 50 | L10: 20 | M10: =I10+J10+L10 -> 120 | N10: =H10+M10 -> 320
A11: 7 | B11: Радослав Боянов Комитов | C11: Log32000 | D11: Log31003 | E11: 100 | F11: 15 | G11: 100 | H11: 215 | I11: 84 | J11: 20 | K11: 40 | L11: 0 | M11: =I11+J11+L11 -> 104 | N11: =H11+M11 -> 319
A12: 8 | B12: Ивайло Детелинов Чернев | C12: Log32002 | D12: Log31001 | E12: 100 | F12: 10 | G12: 50 | H12: 160 | I12: 92 | J12: 0 | K12: 10 | L12: 20 | M12: =I12+J12+L12 -> 112 | N12: =H12+M12 -> 272
A13: 9 | B13: Никола Ясенов Божинов | C13: Log32001 | D13: Log31007 | E13: 40 | F13: 30 | G13: 100 | H13: 170 | I13: 100 | J13: 0 | K13: 0 | L13: 0 | M13: =I13+J13+L13 -> 100 | N13: =H13+M13 -> 270
A14: 10 | B14: Валерия Цанкова Станева | C14: Log32015 | D14: Log31009 | E14: 100 | F14: 15 | G14: 50 | H14: 165 | I14: 100 | J14: 0 | K14: 10 | L14: 0 | M14: =I14+J14+L14 -> 100 | N14: =H14+M14 -> 265
A15: 11 | B15: Румен Руменов Данговски | C15: Log32004 | D15: Log31002 | E15: 40 | F15: 10 | G15: 100 | H15: 150 | I15: 52 | J15: 0 | K15: 40 | L15: 20 | M15: =I15+J15+L15 -> 72 | N15: =H15+M15 -> 222
A16: 12-13 | B16: Иван Петров Тончев | C16: Log32007 | D16: Log31020 | E16: 0 | F16: 25 | G16: 30 | H16: 55 | I16: 72 | J16: 0 | K16: 10 | L16: 90 | M16: =I16+J16+L16 -> 162 | N16: =H16+M16 -> 217
A17: 12-13 | B17: Христо Цветанов Стоянов | C17: Log32020 | D17: Log31010 | E17: 100 | F17: 35 | G17: 50 | H17: 185 | I17: 32 | J17: 0 | K17: 10 | L17: 0 | M17: =I17+J17+L17 -> 32 | N17: =H17+M17 -> 217
A18: 14 | B18: Стефан Веселинов Иванов | C18: Log32014 | D18: Log31011 | E18: 30 | F18: 10 | G18: 100 | H18: 140 | I18: 72 | J18: 0 | K18: 0 | L18: 0 | M18: =I18+J18+L18 -> 72 | N18: =H18+M18 -> 212
A19: 15 | B19: Ивайло Валериев Хартарски | C19: Log32005 | D19: Log31018 | E19: 60 | F19: 0 | G19: 100 | H19: 160 | I19: 24 | J19: 20 | K19: 60 | L19: 0 | M19: =I19+J19+L19 -> 44 | N19: =H19+M19 -> 204
A20: 16 | B20: Христиан Тихомиров Христов | C20: Log32019 | D20: Log31005 | E20: 10 | F20: 10 | G20: 100 | H20: 120 | I20: 68 | J20: 0 | K20: 10 | L20: 0 | M20: =I20+J20+L20 -> 68 | N20: =H20+M20 -> 188
A21: 17 | B21: Maria Mateescu | D21: Log31004 | E21: 40 | F21: 5 | G21: 40 | H21: 85 | I21: 100 | J21: 0 | K21: 0 | L21: 0 | M21: =I21+J21+L21 -> 100 | N21: =H21+M21 -> 185
A22: 18 | B22: Ивелин Свиленов Рачев | C22: Log32011 | D22: Log31012 | E22: 20 | F22: 0 | G22: 50 | H22: 70 | I22: 80 | J22: 0 | K22: 0 | L22: 0 | M22: =I22+J22+L22 -> 80 | N22: =H22+M22 -> 150
A23: 19 | B23: Елица Огнянова Банкова | C23: Log32017 | D23: Log31006 | E23: 10 | F23: 15 | G23: 40 | H23: 65 | I23: 48 | J23: 0 | K23: 20 | L23: 0 | M23: =I23+J23+L23 -> 48 | N23: =H23+M23 -> 113
A24: 20 | B24: Alexandru-Vasile-IosifCitea | D24: romC2 | E24: 0 | F24: 0 | G24: 30 | H24: 30 | I24: 80 | J24: 0 | K24: 0 | L24: 0 | M24: =I24+J24+L24 -> 80 | N24: =H24+M24 -> 110
A25: 21 | B25: Даниел Петев Дакев | C25: Log32012 | D25: Log31015 | E25: 0 | F25: 10 | G25: 80 | H25: 90 | I25: 16 | J25: 0 | K25: 0 | L25: 0 | M25: =I25+J25+L25 -> 16 | N25: =H25+M25 -> 106
A26: 22 | B26: Кристиян Людмилов Цъклев | C26: Log32010 | D26: Log31016 | E26: 10 | F26: 10 | G26: 50 | H26: 70 | I26: 32 | J26: 0 | K26: 0 | L26: 0 | M26: =I26+J26+L26 -> 32 | N26: =H26+M26 -> 102