A1: НАЦИОНАЛЕН ПРОЛЕТЕН ТУРНИР ПО ИНФОРМАТИКА
A2: Ямбол, 12 -14 юни 2009 г.
A4: Класиране на участниците в група C
B7: Име | C7: Град | D7: Total | E7: Група | F7: Клас | G7: Училище | H7: Login | I7: Kabel | AI7: Cross | AT7: String
I8: 1 | J8: 2 | K8: 3 | L8: 4 | M8: 5 | N8: 6 | O8: 7 | P8: 8 | Q8: 9 | R8: 10 | S8: 11 | T8: 12 | U8: 13 | V8: 14 | W8: 15 | X8: 16 | Y8: 17 | Z8: 18 | AA8: 19 | AB8: 20 | AC8: 21 | AD8: 22 | AE8: 23 | AF8: 24 | AG8: 25 | AH8: total | AI8: 1 | AJ8: 2 | AK8: 3 | AL8: 4 | AM8: 5 | AN8: 6 | AO8: 7 | AP8: 8 | AQ8: 9 | AR8: 10 | AS8: total | AT8: 1 | AU8: 2 | AV8: 3 | AW8: 4 | AX8: 5 | AY8: 6 | AZ8: 7 | BA8: 8 | BB8: 9 | BC8: 10 | BD8: total
A9: 1 | B9: Симеон Иванов Иванов | C9: Шумен | D9: =AH9+AS9+BD9 -> 300 | E9: C | F9: 8 | G9: ПМГ "Н.Попович", Школа А&Б | H9: C023 | I9: 4 | J9: 4 | K9: 4 | L9: 4 | M9: 4 | N9: 4 | O9: 4 | P9: 4 | Q9: 4 | R9: 4 | S9: 4 | T9: 4 | U9: 4 | V9: 4 | W9: 4 | X9: 4 | Y9: 4 | Z9: 4 | AA9: 4 | AB9: 4 | AC9: 4 | AD9: 4 | AE9: 4 | AF9: 4 | AG9: 4 | AH9: =SUM(I9:AG9) -> 100 | AI9: 10 | AJ9: 10 | AK9: 10 | AL9: 10 | AM9: 10 | AN9: 10 | AO9: 10 | AP9: 10 | AQ9: 10 | AR9: 10 | AS9: =SUM(AI9:AR9) -> 100 | AT9: 10 | AU9: 10 | AV9: 10 | AW9: 10 | AX9: 10 | AY9: 10 | AZ9: 10 | BA9: 10 | BB9: 10 | BC9: 10 | BD9: =SUM(AT9:BC9) -> 100
A10: 1 | B10: Кирил Христов Кафадаров | C10: Пловдив | D10: =AH10+AS10+BD10 -> 300 | E10: C | F10: 8 | G10: ОМГ "Акад. К. Попов" | H10: C030 | I10: 4 | J10: 4 | K10: 4 | L10: 4 | M10: 4 | N10: 4 | O10: 4 | P10: 4 | Q10: 4 | R10: 4 | S10: 4 | T10: 4 | U10: 4 | V10: 4 | W10: 4 | X10: 4 | Y10: 4 | Z10: 4 | AA10: 4 | AB10: 4 | AC10: 4 | AD10: 4 | AE10: 4 | AF10: 4 | AG10: 4 | AH10: =SUM(I10:AG10) -> 100 | AI10: 10 | AJ10: 10 | AK10: 10 | AL10: 10 | AM10: 10 | AN10: 10 | AO10: 10 | AP10: 10 | AQ10: 10 | AR10: 10 | AS10: =SUM(AI10:AR10) -> 100 | AT10: 10 | AU10: 10 | AV10: 10 | AW10: 10 | AX10: 10 | AY10: 10 | AZ10: 10 | BA10: 10 | BB10: 10 | BC10: 10 | BD10: =SUM(AT10:BC10) -> 100
A11: 3 | B11: Калина Христова Петрова | C11: Пловдив | D11: =AH11+AS11+BD11 -> 250 | E11: C | F11: 8 | G11: ОМГ "Акад. К. Попов" | H11: C024 | I11: 4 | J11: 4 | K11: x | L11: x | M11: 4 | N11: x | O11: 4 | P11: 4 | Q11: 4 | R11: x | S11: x | T11: 4 | U11: 4 | V11: 4 | W11: x | X11: x | Y11: x | Z11: 4 | AA11: 4 | AB11: 4 | AC11: 4 | AD11: 4 | AE11: x | AF11: x | AG11: 4 | AH11: =SUM(I11:AG11) -> 60 | AI11: 10 | AJ11: 10 | AK11: 10 | AL11: 10 | AM11: 10 | AN11: 10 | AO11: 10 | AP11: x | AQ11: 10 | AR11: 10 | AS11: =SUM(AI11:AR11) -> 90 | AT11: 10 | AU11: 10 | AV11: 10 | AW11: 10 | AX11: 10 | AY11: 10 | AZ11: 10 | BA11: 10 | BB11: 10 | BC11: 10 | BD11: =SUM(AT11:BC11) -> 100
A12: 4 | B12: Христиан Тихомиров Христов | C12: Русе | D12: =AH12+AS12+BD12 -> 240 | E12: C | F12: 7 | G12: ЦУТНТ - МГ "Баба Тонка" | H12: C025 | I12: x | J12: x | K12: x | L12: 4 | M12: 4 | N12: 4 | O12: 4 | P12: 4 | Q12: 4 | R12: x | S12: x | T12: 4 | U12: 4 | V12: x | W12: x | X12: 4 | Y12: x | Z12: x | AA12: x | AB12: x | AC12: 4 | AD12: x | AE12: x | AF12: x | AG12: x | AH12: =SUM(I12:AG12) -> 40 | AI12: 10 | AJ12: 10 | AK12: 10 | AL12: 10 | AM12: 10 | AN12: 10 | AO12: 10 | AP12: 10 | AQ12: 10 | AR12: 10 | AS12: =SUM(AI12:AR12) -> 100 | AT12: 10 | AU12: 10 | AV12: 10 | AW12: 10 | AX12: 10 | AY12: 10 | AZ12: 10 | BA12: 10 | BB12: 10 | BC12: 10 | BD12: =SUM(AT12:BC12) -> 100
A13: 5 | B13: Момчил Павлинов Пейчев | C13: Варна | D13: =AH13+AS13+BD13 -> 234 | E13: C | F13: 7 | G13: МГ "Д-р Петър Берон" | H13: C029 | I13: 4 | J13: 4 | K13: 4 | L13: 4 | M13: x | N13: 4 | O13: 4 | P13: 4 | Q13: 4 | R13: 4 | S13: t | T13: t | U13: 4 | V13: t | W13: x | X13: x | Y13: 4 | Z13: x | AA13: 4 | AB13: t | AC13: 4 | AD13: 4 | AE13: 4 | AF13: x | AG13: 4 | AH13: =SUM(I13:AG13) -> 64 | AI13: 10 | AJ13: 10 | AK13: 10 | AL13: 10 | AM13: 10 | AN13: x | AO13: 10 | AP13: 10 | AQ13: e | AR13: t | AS13: =SUM(AI13:AR13) -> 70 | AT13: 10 | AU13: 10 | AV13: 10 | AW13: 10 | AX13: 10 | AY13: 10 | AZ13: 10 | BA13: 10 | BB13: 10 | BC13: 10 | BD13: =SUM(AT13:BC13) -> 100
A14: 6 | B14: Георги Николаев Георгиев | C14: София | D14: =AH14+AS14+BD14 -> 228 | E14: C | F14: 8 | G14: СМГ "Паисий Хилендарски" | H14: C021 | I14: 4 | J14: x | K14: x | L14: x | M14: 4 | N14: x | O14: x | P14: 4 | Q14: x | R14: x | S14: 4 | T14: 4 | U14: x | V14: 4 | W14: x | X14: x | Y14: x | Z14: x | AA14: x | AB14: x | AC14: 4 | AD14: x | AE14: x | AF14: x | AG14: x | AH14: =SUM(I14:AG14) -> 28 | AI14: 10 | AJ14: 10 | AK14: 10 | AL14: 10 | AM14: 10 | AN14: 10 | AO14: 10 | AP14: 10 | AQ14: 10 | AR14: 10 | AS14: =SUM(AI14:AR14) -> 100 | AT14: 10 | AU14: 10 | AV14: 10 | AW14: 10 | AX14: 10 | AY14: 10 | AZ14: 10 | BA14: 10 | BB14: 10 | BC14: 10 | BD14: =SUM(AT14:BC14) -> 100
A15: 7 | B15: Росен Иванов Желев | C15: Пловдив | D15: =AH15+AS15+BD15 -> 224 | E15: C | F15: 8 | G15: ОМГ "Акад. К. Попов" | H15: C032 | I15: 4 | J15: x | K15: x | L15: x | M15: x | N15: x | O15: x | P15: 4 | Q15: x | R15: x | S15: 4 | T15: 4 | U15: x | V15: 4 | W15: x | X15: x | Y15: x | Z15: x | AA15: x | AB15: x | AC15: 4 | AD15: x | AE15: x | AF15: x | AG15: x | AH15: =SUM(I15:AG15) -> 24 | AI15: 10 | AJ15: 10 | AK15: 10 | AL15: 10 | AM15: 10 | AN15: 10 | AO15: 10 | AP15: 10 | AQ15: 10 | AR15: 10 | AS15: =SUM(AI15:AR15) -> 100 | AT15: 10 | AU15: 10 | AV15: 10 | AW15: 10 | AX15: 10 | AY15: 10 | AZ15: 10 | BA15: 10 | BB15: 10 | BC15: 10 | BD15: =SUM(AT15:BC15) -> 100
A16: 8 | B16: Симо Тонев Илиев | C16: Пловдив | D16: =AH16+AS16+BD16 -> 216 | E16: C | F16: 8 | G16: ОМГ "Акад. К. Попов" | H16: C005 | I16: x | J16: x | K16: x | L16: x | M16: x | N16: x | O16: x | P16: x | Q16: 4 | R16: x | S16: x | T16: x | U16: 4 | V16: 4 | W16: x | X16: x | Y16: x | Z16: x | AA16: x | AB16: x | AC16: 4 | AD16: x | AE16: x | AF16: x | AG16: x | AH16: =SUM(I16:AG16) -> 16 | AI16: 10 | AJ16: 10 | AK16: 10 | AL16: 10 | AM16: 10 | AN16: 10 | AO16: 10 | AP16: 10 | AQ16: 10 | AR16: 10 | AS16: =SUM(AI16:AR16) -> 100 | AT16: 10 | AU16: 10 | AV16: 10 | AW16: 10 | AX16: 10 | AY16: 10 | AZ16: 10 | BA16: 10 | BB16: 10 | BC16: 10 | BD16: =SUM(AT16:BC16) -> 100
A17: 8 | B17: Радослав Боянов Комитов | C17: Ямбол | D17: =AH17+AS17+BD17 -> 216 | E17: C | F17: 8 | G17: МГ "Атанас Радев" | H17: C031 | I17: x | J17: x | K17: x | L17: 4 | M17: x | N17: x | O17: 4 | P17: 4 | Q17: x | R17: x | S17: x | T17: x | U17: x | V17: 4 | W17: x | X17: x | Y17: x | Z17: x | AA17: x | AB17: x | AC17: x | AD17: x | AE17: x | AF17: x | AG17: x | AH17: =SUM(I17:AG17) -> 16 | AI17: 10 | AJ17: 10 | AK17: 10 | AL17: 10 | AM17: 10 | AN17: 10 | AO17: 10 | AP17: 10 | AQ17: 10 | AR17: 10 | AS17: =SUM(AI17:AR17) -> 100 | AT17: 10 | AU17: 10 | AV17: 10 | AW17: 10 | AX17: 10 | AY17: 10 | AZ17: 10 | BA17: 10 | BB17: 10 | BC17: 10 | BD17: =SUM(AT17:BC17) -> 100
A18: 10 | B18: Христо Цветанов Стоянов | C18: София | D18: =AH18+AS18+BD18 -> 188 | E18: C | F18: 6 | G18: СМГ "Паисий Хилендарски" | H18: C027 | I18: x | J18: x | K18: x | L18: x | M18: x | N18: x | O18: x | P18: x | Q18: 4 | R18: x | S18: x | T18: x | U18: 4 | V18: x | W18: x | X18: x | Y18: x | Z18: x | AA18: x | AB18: x | AC18: x | AD18: x | AE18: x | AF18: x | AG18: x | AH18: =SUM(I18:AG18) -> 8 | AI18: 10 | AJ18: 10 | AK18: 10 | AL18: 10 | AM18: 10 | AN18: 10 | AO18: 10 | AP18: 10 | AQ18: t | AR18: t | AS18: =SUM(AI18:AR18) -> 80 | AT18: 10 | AU18: 10 | AV18: 10 | AW18: 10 | AX18: 10 | AY18: 10 | AZ18: 10 | BA18: 10 | BB18: 10 | BC18: 10 | BD18: =SUM(AT18:BC18) -> 100
A19: 11 | B19: Стефан Веселинов Иванов | C19: Плевен | D19: =AH19+AS19+BD19 -> 154 | E19: C | F19: 7 | G19: ЦУТНТ, МГ "Гео Милев" | H19: C017 | I19: x | J19: x | K19: x | L19: 4 | M19: 4 | N19: 4 | O19: 4 | P19: 4 | Q19: 4 | R19: x | S19: 4 | T19: 4 | U19: 4 | V19: x | W19: x | X19: 4 | Y19: x | Z19: x | AA19: x | AB19: x | AC19: 4 | AD19: x | AE19: x | AF19: x | AG19: x | AH19: =SUM(I19:AG19) -> 44 | AI19: x | AJ19: x | AK19: 10 | AL19: x | AM19: x | AN19: x | AO19: x | AP19: x | AQ19: x | AR19: x | AS19: =SUM(AI19:AR19) -> 10 | AT19: 10 | AU19: 10 | AV19: 10 | AW19: 10 | AX19: 10 | AY19: 10 | AZ19: 10 | BA19: 10 | BB19: 10 | BC19: 10 | BD19: =SUM(AT19:BC19) -> 100
A20: 12 | B20: Валерия Цанкова Станева | C20: Варна | D20: =AH20+AS20+BD20 -> 148 | E20: C | F20: 7 | G20: МГ "Д-р Петър Берон" | H20: C022 | I20: x | J20: x | K20: x | L20: x | M20: 4 | N20: x | O20: 4 | P20: 4 | Q20: 4 | R20: x | S20: x | T20: x | U20: 4 | V20: 4 | W20: x | X20: x | Y20: x | Z20: x | AA20: x | AB20: x | AC20: 4 | AD20: x | AE20: x | AF20: x | AG20: x | AH20: =SUM(I20:AG20) -> 28 | AI20: x | AJ20: x | AK20: 10 | AL20: x | AM20: 10 | AN20: x | AO20: x | AP20: x | AQ20: x | AR20: x | AS20: =SUM(AI20:AR20) -> 20 | AT20: 10 | AU20: 10 | AV20: 10 | AW20: 10 | AX20: 10 | AY20: 10 | AZ20: 10 | BA20: 10 | BB20: 10 | BC20: 10 | BD20: =SUM(AT20:BC20) -> 100
A21: 13 | B21: Елица Огнянова Банкова | C21: Плевен | D21: =AH21+AS21+BD21 -> 142 | E21: C | F21: 7 | G21: ЦУТНТ, МГ "Гео Милев" | H21: C013 | I21: x | J21: x | K21: x | L21: 4 | M21: 4 | N21: 4 | O21: x | P21: 4 | Q21: 4 | R21: x | S21: x | T21: 4 | U21: 4 | V21: x | W21: x | X21: x | Y21: x | Z21: x | AA21: x | AB21: x | AC21: 4 | AD21: x | AE21: x | AF21: x | AG21: x | AH21: =SUM(I21:AG21) -> 32 | AI21: x | AJ21: x | AK21: 10 | AL21: x | AM21: x | AN21: x | AO21: x | AP21: x | AQ21: x | AR21: x | AS21: =SUM(AI21:AR21) -> 10 | AT21: 10 | AU21: 10 | AV21: 10 | AW21: 10 | AX21: 10 | AY21: 10 | AZ21: 10 | BA21: 10 | BB21: 10 | BC21: 10 | BD21: =SUM(AT21:BC21) -> 100
A22: 14 | B22: Никола Ясенов Божинов | C22: София | D22: =AH22+AS22+BD22 -> 136 | E22: C | F22: 8 | G22: СМГ "Паисий Хилендарски" | H22: C020 | I22: x | J22: x | K22: x | L22: x | M22: 4 | N22: x | O22: x | P22: 4 | Q22: 4 | R22: x | S22: 4 | T22: 4 | U22: 4 | V22: 4 | W22: x | X22: x | Y22: x | Z22: 4 | AA22: x | AB22: x | AC22: 4 | AD22: x | AE22: x | AF22: x | AG22: x | AH22: =SUM(I22:AG22) -> 36 | AI22: - | AJ22: - | AK22: - | AL22: - | AM22: - | AN22: - | AO22: - | AP22: - | AQ22: - | AR22: - | AS22: =SUM(AI22:AR22) -> 0 | AT22: 10 | AU22: 10 | AV22: 10 | AW22: 10 | AX22: 10 | AY22: 10 | AZ22: 10 | BA22: 10 | BB22: 10 | BC22: 10 | BD22: =SUM(AT22:BC22) -> 100
A23: 15 | B23: Румен Руменов Данговски | C23: Плевен | D23: =AH23+AS23+BD23 -> 132 | E23: C | F23: 7 | G23: ЦУТНТ, МГ "Гео Милев" | H23: C028 | I23: x | J23: x | K23: x | L23: 4 | M23: 4 | N23: x | O23: 4 | P23: 4 | Q23: 4 | R23: x | S23: x | T23: e | U23: 4 | V23: 4 | W23: x | X23: x | Y23: x | Z23: x | AA23: x | AB23: e | AC23: 4 | AD23: x | AE23: x | AF23: x | AG23: x | AH23: =SUM(I23:AG23) -> 32 | AI23: x | AJ23: x | AK23: 10 | AL23: 10 | AM23: x | AN23: 10 | AO23: x | AP23: x | AQ23: x | AR23: x | AS23: =SUM(AI23:AR23) -> 30 | AT23: 10 | AU23: 10 | AV23: 10 | AW23: 10 | AX23: 10 | AY23: 10 | AZ23: 10 | BA23: t | BB23: t | BC23: t | BD23: =SUM(AT23:BC23) -> 70
A24: 16 | B24: Иван Петров Тончев | C24: София | D24: =AH24+AS24+BD24 -> 118 | E24: C | F24: 6 | G24: СМГ "Паисий Хилендарски" | H24: C015 | I24: x | J24: x | K24: x | L24: x | M24: x | N24: x | O24: x | P24: x | Q24: 4 | R24: x | S24: x | T24: x | U24: 4 | V24: x | W24: x | X24: x | Y24: x | Z24: x | AA24: x | AB24: x | AC24: x | AD24: x | AE24: x | AF24: x | AG24: x | AH24: =SUM(I24:AG24) -> 8 | AI24: x | AJ24: x | AK24: x | AL24: x | AM24: x | AN24: 10 | AO24: x | AP24: x | AQ24: x | AR24: x | AS24: =SUM(AI24:AR24) -> 10 | AT24: 10 | AU24: 10 | AV24: 10 | AW24: 10 | AX24: 10 | AY24: 10 | AZ24: 10 | BA24: 10 | BB24: 10 | BC24: 10 | BD24: =SUM(AT24:BC24) -> 100
A25: 16 | B25: Ивайло Детелинов Чернев | C25: Шумен | D25: =AH25+AS25+BD25 -> 118 | E25: C | F25: 8 | G25: ПМГ "Н.Попович", Школа А&Б | H25: C026 | I25: x | J25: x | K25: x | L25: x | M25: x | N25: x | O25: x | P25: x | Q25: 4 | R25: x | S25: x | T25: x | U25: 4 | V25: x | W25: x | X25: x | Y25: x | Z25: x | AA25: x | AB25: x | AC25: x | AD25: x | AE25: x | AF25: x | AG25: x | AH25: =SUM(I25:AG25) -> 8 | AI25: x | AJ25: x | AK25: 10 | AL25: x | AM25: x | AN25: x | AO25: x | AP25: x | AQ25: x | AR25: x | AS25: =SUM(AI25:AR25) -> 10 | AT25: 10 | AU25: 10 | AV25: 10 | AW25: 10 | AX25: 10 | AY25: 10 | AZ25: 10 | BA25: 10 | BB25: 10 | BC25: 10 | BD25: =SUM(AT25:BC25) -> 100
A26: 18 | B26: Стилиян Николаев Емануилов | C26: Шумен | D26: =AH26+AS26+BD26 -> 108 | E26: C | F26: 8 | G26: ПМГ "Н.Попович", Школа А&Б | H26: C018 | I26: x | J26: x | K26: x | L26: 4 | M26: 4 | N26: 4 | O26: x | P26: x | Q26: 4 | R26: x | S26: x | T26: 4 | U26: 4 | V26: x | W26: x | X26: x | Y26: x | Z26: x | AA26: x | AB26: x | AC26: 4 | AD26: x | AE26: x | AF26: x | AG26: x | AH26: =SUM(I26:AG26) -> 28 | AI26: x | AJ26: x | AK26: 10 | AL26: x | AM26: x | AN26: x | AO26: x | AP26: x | AQ26: x | AR26: x | AS26: =SUM(AI26:AR26) -> 10 | AT26: 10 | AU26: 10 | AV26: 10 | AW26: 10 | AX26: 10 | AY26: 10 | AZ26: 10 | BA26: t | BB26: t | BC26: t | BD26: =SUM(AT26:BC26) -> 70
A27: 19 | B27: Кристиян Людмилов Цъклев | C27: София | D27: =AH27+AS27+BD27 -> 100 | E27: C | F27: 6 | G27: СМГ "Паисий Хилендарски" | H27: C016 | I27: x | J27: x | K27: x | L27: x | M27: x | N27: x | O27: x | P27: x | Q27: 4 | R27: x | S27: x | T27: 4 | U27: 4 | V27: x | W27: x | X27: x | Y27: x | Z27: x | AA27: x | AB27: x | AC27: 4 | AD27: x | AE27: x | AF27: 4 | AG27: x | AH27: =SUM(I27:AG27) -> 20 | AI27: x | AJ27: x | AK27: x | AL27: x | AM27: x | AN27: 10 | AO27: x | AP27: x | AQ27: x | AR27: x | AS27: =SUM(AI27:AR27) -> 10 | AT27: 10 | AU27: 10 | AV27: 10 | AW27: 10 | AX27: 10 | AY27: 10 | AZ27: 10 | BA27: t | BB27: t | BC27: t | BD27: =SUM(AT27:BC27) -> 70
A28: 20 | B28: Даниел Петев Дакев | C28: Плевен | D28: =AH28+AS28+BD28 -> 98 | E28: C | F28: 7 | G28: ЦУТНТ, МГ "Гео Милев" | H28: C004 | I28: x | J28: x | K28: x | L28: 4 | M28: 4 | N28: x | O28: x | P28: x | Q28: e | R28: x | S28: x | T28: x | U28: e | V28: x | W28: x | X28: x | Y28: x | Z28: x | AA28: x | AB28: x | AC28: x | AD28: x | AE28: x | AF28: x | AG28: x | AH28: =SUM(I28:AG28) -> 8 | AI28: 10 | AJ28: x | AK28: x | AL28: 10 | AM28: x | AN28: x | AO28: x | AP28: x | AQ28: x | AR28: x | AS28: =SUM(AI28:AR28) -> 20 | AT28: 10 | AU28: 10 | AV28: 10 | AW28: 10 | AX28: 10 | AY28: 10 | AZ28: 10 | BA28: e | BB28: e | BC28: e | BD28: =SUM(AT28:BC28) -> 70
A29: 21 | B29: Мартина Стоянова Коцева | C29: Плевен | D29: =AH29+AS29+BD29 -> 92 | E29: C | F29: 7 | G29: ЦУТНТ, МГ "Гео Милев" | H29: C011 | I29: x | J29: x | K29: x | L29: x | M29: 4 | N29: x | O29: 4 | P29: 4 | Q29: 4 | R29: x | S29: x | T29: 4 | U29: 4 | V29: 4 | W29: x | X29: x | Y29: x | Z29: x | AA29: x | AB29: x | AC29: 4 | AD29: x | AE29: x | AF29: x | AG29: x | AH29: =SUM(I29:AG29) -> 32 | AI29: - | AJ29: - | AK29: - | AL29: - | AM29: - | AN29: - | AO29: - | AP29: - | AQ29: - | AR29: - | AS29: =SUM(AI29:AR29) -> 0 | AT29: 10 | AU29: x | AV29: 10 | AW29: 10 | AX29: 10 | AY29: 10 | AZ29: 10 | BA29: t | BB29: t | BC29: t | BD29: =SUM(AT29:BC29) -> 60
A30: 22 | B30: Ивайло Валериев Хартарски | C30: София | D30: =AH30+AS30+BD30 -> 88 | E30: C | F30: 8 | G30: СМГ "Паисий Хилендарски" | H30: C008 | I30: x | J30: x | K30: x | L30: x | M30: x | N30: x | O30: x | P30: x | Q30: 4 | R30: x | S30: x | T30: x | U30: 4 | V30: x | W30: x | X30: x | Y30: x | Z30: x | AA30: x | AB30: x | AC30: x | AD30: x | AE30: x | AF30: x | AG30: x | AH30: =SUM(I30:AG30) -> 8 | AI30: x | AJ30: x | AK30: x | AL30: 10 | AM30: x | AN30: x | AO30: x | AP30: x | AQ30: x | AR30: x | AS30: =SUM(AI30:AR30) -> 10 | AT30: 10 | AU30: 10 | AV30: 10 | AW30: 10 | AX30: 10 | AY30: 10 | AZ30: 10 | BA30: x | BB30: x | BC30: x | BD30: =SUM(AT30:BC30) -> 70
A31: 23 | B31: Ивелин Свиленов Рачев | C31: Русе | D31: =AH31+AS31+BD31 -> 52 | E31: C | F31: 7 | G31: ЦУТНТ - МГ "Баба Тонка" | H31: C002 | I31: 4 | J31: x | K31: x | L31: 4 | M31: 4 | N31: x | O31: 4 | P31: 4 | Q31: 4 | R31: x | S31: x | T31: 4 | U31: 4 | V31: x | W31: x | X31: x | Y31: x | Z31: x | AA31: x | AB31: x | AC31: x | AD31: x | AE31: x | AF31: x | AG31: x | AH31: =SUM(I31:AG31) -> 32 | AI31: x | AJ31: x | AK31: x | AL31: x | AM31: x | AN31: x | AO31: x | AP31: x | AQ31: x | AR31: x | AS31: =SUM(AI31:AR31) -> 0 | AT31: 10 | AU31: 10 | AV31: t | AW31: t | AX31: t | AY31: t | AZ31: t | BA31: t | BB31: t | BC31: t | BD31: =SUM(AT31:BC31) -> 20
A32: 24 | B32: Гален Пламенов Георгиев | C32: Шумен | D32: =AH32+AS32+BD32 -> 30 | E32: C | F32: 8 | G32: ПМГ "Н.Попович", Школа А&Б | H32: C014 | I32: x | J32: x | K32: x | L32: 4 | M32: 4 | N32: x | O32: x | P32: x | Q32: 4 | R32: x | S32: x | T32: 4 | U32: 4 | V32: x | W32: x | X32: x | Y32: x | Z32: x | AA32: x | AB32: x | AC32: x | AD32: x | AE32: x | AF32: x | AG32: x | AH32: =SUM(I32:AG32) -> 20 | AI32: x | AJ32: x | AK32: x | AL32: 10 | AM32: x | AN32: x | AO32: x | AP32: x | AQ32: x | AR32: x | AS32: =SUM(AI32:AR32) -> 10 | AT32: x | AU32: x | AV32: x | AW32: x | AX32: x | AY32: x | AZ32: x | BA32: t | BB32: t | BC32: t | BD32: =SUM(AT32:BC32) -> 0
A33: 24 | B33: Рали Емилов Ралев | C33: Габрово | D33: =AH33+AS33+BD33 -> 30 | E33: C | F33: 8 | G33: ПМГ "Академик Иван Гюзелев" | H33: C019 | I33: x | J33: x | K33: x | L33: x | M33: 4 | N33: x | O33: x | P33: x | Q33: 4 | R33: x | S33: x | T33: 4 | U33: 4 | V33: x | W33: x | X33: x | Y33: x | Z33: x | AA33: x | AB33: x | AC33: 4 | AD33: x | AE33: x | AF33: x | AG33: x | AH33: =SUM(I33:AG33) -> 20 | AI33: - | AJ33: - | AK33: - | AL33: - | AM33: - | AN33: - | AO33: - | AP33: - | AQ33: - | AR33: - | AS33: =SUM(AI33:AR33) -> 0 | AT33: 10 | AU33: x | AV33: x | AW33: x | AX33: x | AY33: x | AZ33: x | BA33: x | BB33: x | BC33: x | BD33: =SUM(AT33:BC33) -> 10
A34: 26 | B34: Явор Жулиенов Станков | C34: Шумен | D34: =AH34+AS34+BD34 -> 28 | E34: C | F34: 8 | G34: ПМГ "Н.Попович", Школа А&Б | H34: C007 | I34: x | J34: x | K34: x | L34: x | M34: x | N34: x | O34: x | P34: x | Q34: 4 | R34: x | S34: x | T34: x | U34: 4 | V34: x | W34: x | X34: x | Y34: x | Z34: x | AA34: x | AB34: x | AC34: x | AD34: x | AE34: x | AF34: x | AG34: x | AH34: =SUM(I34:AG34) -> 8 | AI34: x | AJ34: x | AK34: x | AL34: 10 | AM34: x | AN34: x | AO34: x | AP34: x | AQ34: x | AR34: x | AS34: =SUM(AI34:AR34) -> 10 | AT34: 10 | AU34: x | AV34: x | AW34: x | AX34: x | AY34: x | AZ34: x | BA34: x | BB34: x | BC34: x | BD34: =SUM(AT34:BC34) -> 10
A35: 27 | B35: Румен Иванов Руменов | C35: София | D35: =AH35+AS35+BD35 -> 26 | E35: C | F35: 8 | G35: СМГ "Паисий Хилендарски" | H35: C009 | I35: x | J35: x | K35: x | L35: x | M35: x | N35: x | O35: 4 | P35: 4 | Q35: 4 | R35: x | S35: x | T35: x | U35: 4 | V35: x | W35: x | X35: x | Y35: x | Z35: x | AA35: x | AB35: x | AC35: x | AD35: x | AE35: x | AF35: x | AG35: x | AH35: =SUM(I35:AG35) -> 16 | AI35: - | AJ35: - | AK35: - | AL35: - | AM35: - | AN35: - | AO35: - | AP35: - | AQ35: - | AR35: - | AS35: =SUM(AI35:AR35) -> 0 | AT35: 10 | AU35: x | AV35: x | AW35: x | AX35: x | AY35: x | AZ35: x | BA35: x | BB35: x | BC35: x | BD35: =SUM(AT35:BC35) -> 10
A36: 28 | B36: Аксел Адем Хълми | C36: Шумен | D36: =AH36+AS36+BD36 -> 18 | E36: C | F36: 8 | G36: ПМГ "Н.Попович", Школа А&Б | H36: C003 | I36: x | J36: x | K36: x | L36: x | M36: x | N36: x | O36: x | P36: x | Q36: 4 | R36: x | S36: x | T36: x | U36: 4 | V36: x | W36: x | X36: x | Y36: x | Z36: x | AA36: x | AB36: x | AC36: x | AD36: x | AE36: x | AF36: x | AG36: x | AH36: =SUM(I36:AG36) -> 8 | AI36: - | AJ36: - | AK36: - | AL36: - | AM36: - | AN36: - | AO36: - | AP36: - | AQ36: - | AR36: - | AS36: =SUM(AI36:AR36) -> 0 | AT36: 10 | AU36: x | AV36: x | AW36: x | AX36: x | AY36: x | AZ36: x | BA36: x | BB36: x | BC36: x | BD36: =SUM(AT36:BC36) -> 10
A37: 29 | B37: Здравко Иванов Иванов | C37: Ямбол | D37: =AH37+AS37+BD37 -> 16 | E37: C | F37: 7 | G37: МГ "Атанас Радев" | H37: C006 | I37: x | J37: x | K37: x | L37: x | M37: x | N37: x | O37: x | P37: x | Q37: 4 | R37: x | S37: x | T37: x | U37: 4 | V37: 4 | W37: x | X37: x | Y37: x | Z37: x | AA37: x | AB37: x | AC37: 4 | AD37: x | AE37: x | AF37: x | AG37: x | AH37: =SUM(I37:AG37) -> 16 | AI37: x | AJ37: x | AK37: x | AL37: x | AM37: x | AN37: x | AO37: x | AP37: x | AQ37: x | AR37: x | AS37: =SUM(AI37:AR37) -> 0 | AT37: x | AU37: x | AV37: x | AW37: x | AX37: x | AY37: x | AZ37: x | BA37: x | BB37: x | BC37: x | BD37: =SUM(AT37:BC37) -> 0
A38: 30 | B38: Любомир Любчов Янчев | C38: София | D38: =AH38+AS38+BD38 -> 8 | E38: C | F38: 7 | G38: 27 СОУ | H38: C001 | I38: x | J38: x | K38: x | L38: x | M38: x | N38: x | O38: x | P38: x | Q38: 4 | R38: x | S38: x | T38: x | U38: 4 | V38: x | W38: x | X38: x | Y38: x | Z38: x | AA38: x | AB38: x | AC38: x | AD38: x | AE38: x | AF38: x | AG38: x | AH38: =SUM(I38:AG38) -> 8 | AI38: - | AJ38: - | AK38: - | AL38: - | AM38: - | AN38: - | AO38: - | AP38: - | AQ38: - | AR38: - | AS38: =SUM(AI38:AR38) -> 0 | AT38: - | AU38: - | AV38: - | AW38: - | AX38: - | AY38: - | AZ38: - | BA38: - | BB38: - | BC38: - | BD38: =SUM(AT38:BC38) -> 0
A39: 30 | B39: Цветан Йорданов Цветков | C39: Шумен | D39: =AH39+AS39+BD39 -> 8 | E39: C | F39: 8 | G39: ПМГ "Н.Попович", Школа А&Б | H39: C010 | I39: x | J39: x | K39: x | L39: x | M39: x | N39: x | O39: x | P39: x | Q39: 4 | R39: x | S39: x | T39: x | U39: 4 | V39: x | W39: x | X39: x | Y39: x | Z39: x | AA39: x | AB39: x | AC39: x | AD39: x | AE39: x | AF39: x | AG39: x | AH39: =SUM(I39:AG39) -> 8 | AI39: - | AJ39: - | AK39: - | AL39: - | AM39: - | AN39: - | AO39: - | AP39: - | AQ39: - | AR39: - | AS39: =SUM(AI39:AR39) -> 0 | AT39: - | AU39: - | AV39: - | AW39: - | AX39: - | AY39: - | AZ39: - | BA39: - | BB39: - | BC39: - | BD39: =SUM(AT39:BC39) -> 0
A40: 32 | B40: Тифани Николова Куртева | C40: Бургас | D40: =AH40+AS40+BD40 -> 0 | E40: C | F40: 8 | G40: ПМГ "Акад. Н. Обрешков" | H40: C012 | I40: - | J40: - | K40: - | L40: - | M40: - | N40: - | O40: - | P40: - | Q40: - | R40: - | S40: - | T40: - | U40: - | V40: - | W40: - | X40: - | Y40: - | Z40: - | AA40: - | AB40: - | AC40: - | AD40: - | AE40: - | AF40: - | AG40: - | AH40: =SUM(I40:AG40) -> 0 | AI40: - | AJ40: - | AK40: - | AL40: - | AM40: - | AN40: - | AO40: - | AP40: - | AQ40: - | AR40: - | AS40: =SUM(AI40:AR40) -> 0 | AT40: - | AU40: - | AV40: - | AW40: - | AX40: - | AY40: - | AZ40: - | BA40: - | BB40: - | BC40: - | BD40: =SUM(AT40:BC40) -> 0